{"assets":[{"path":"assets/app-BWLKy961.js","role":"application-js","sha256":"dbbe5b4d736018c259bebc5d5b73c617507d8dca41d03a26dff41938af27df33"},{"path":"assets/app-EPFmzGxS.css","role":"application-css","sha256":"453ec25a94e7097498b461cb67af6a9c48413dcafe0703349ec3a4c53a0b84c0"}],"consumer_contract":{"path":"consumer-contract.json","sha256":"840d37c90e06f2821aba51b3288fe0209c3e7bc7d683478833de2ed0009d7b37"},"format_version":1,"hash_algorithm":"sha256","manifest_schema":{"path":"artifact-manifest.schema.json","sha256":"aad3f528c618f11f5da1f1b172a22ff24612fbc64c141a6612b9f188fc3bc609"},"static_entry":{"path":"index.html","sha256":"8787b52f1f645dedddd270145484531c9b90469bae1418920e9111ab5e984c19"},"template":{"content_security_policy":"default-src 'none'; script-src data:; style-src data:; img-src data:; connect-src 'none'; base-uri 'none'; form-action 'none'; object-src 'none'","path":"standalone-template.html","payload_element_id":"moodboard-report","payload_token":"__MOODBOARD_REPORT_BASE64__","payload_token_count":1,"sha256":"a33e2100712aaca659056385cd1d036caf52fa774cc5821f9277ca06572e501c"},"verification_toolchain":{"path":"verification-toolchain.json","sha256":"146d9aba4018334b1c17b085920fb4cbf28a91d82a9650bc99e529f3398635c6"},"viewer_version":"0.1.0","writer_schemas":[{"path":"schemas/report_v1_0.schema.json","schema_version":"1.0","sha256":"6b1ab98734ab49ac35f57bb5a1db12a562501c37546641badf41f7a4fde55cb5"},{"path":"schemas/report_v1_1.schema.json","schema_version":"1.1","sha256":"5eb8a20e865612676e89f2cd58ab17108c715102e66d66680a5ceb1cd7626ed8"}]}
